{
 "name": "goodbye",
 "description": "Slow farewell wave finishing with a small bow.",
 "duration": 3.6,
 "loop": false,
 "priority": 6,
 "keys": [
  {
   "t": 0,
   "raw": {
    "upperarm_R": [0, 0, 0],
    "forearm_R": [0, 0, 0],
    "finger_index_1_R": [0, 0, 0],
    "finger_ring_1_R": [0, 0, 0],
    "head": [0, 0, 0],
    "spine": [0, 0, 0],
    "chest": [0, 0, 0]
   }
  },
  {
   "t": 0.1,
   "raw": {
    "upperarm_R": [-0.87, -6.8, -6.46],
    "forearm_R": [-8.48, 0, 0],
    "finger_index_1_R": [-0.52, 0, 0],
    "finger_ring_1_R": [0.52, 0, 0],
    "head": [-0.42, 0, -0.42],
    "spine": [0, 0, 0],
    "chest": [0, 0, 0]
   }
  },
  {
   "t": 0.2,
   "raw": {
    "upperarm_R": [-3.01, -23.44, -22.27],
    "forearm_R": [-30.62, 0, 0],
    "finger_index_1_R": [-1.8, 0, 0],
    "finger_ring_1_R": [1.8, 0, 0],
    "head": [-1.41, 0, -1.41],
    "spine": [0, 0, 0],
    "chest": [0, 0, 0]
   }
  },
  {
   "t": 0.3,
   "raw": {
    "upperarm_R": [-5.68, -44.3, -42.09],
    "forearm_R": [-57.64, 0, 0],
    "finger_index_1_R": [-3.41, 0, 0],
    "finger_ring_1_R": [3.41, 0, 0],
    "head": [-2.59, 0, -2.59],
    "spine": [0, 0, 0],
    "chest": [0, 0, 0]
   }
  },
  {
   "t": 0.4,
   "raw": {
    "upperarm_R": [-8.17, -63.76, -60.57],
    "forearm_R": [-73.55, 0, 0],
    "finger_index_1_R": [-4.9, 0, 0],
    "finger_ring_1_R": [4.9, 0, 0],
    "head": [-3.58, 0, -3.58],
    "spine": [0, 0, 0],
    "chest": [0, 0, 0]
   }
  },
  {
   "t": 0.5,
   "raw": {
    "upperarm_R": [-9.77, -76.18, -72.37],
    "forearm_R": [-75.62, 0, 0],
    "finger_index_1_R": [-5.86, 0, 0],
    "finger_ring_1_R": [5.86, 0, 0],
    "head": [-4, 0, -4],
    "spine": [0, 0, 0],
    "chest": [0, 0, 0]
   }
  },
  {
   "t": 0.6,
   "raw": {
    "upperarm_R": [-10, -78, -74.1],
    "forearm_R": [-79.11, 0, 0],
    "finger_index_1_R": [-6, 0, 0],
    "finger_ring_1_R": [6, 0, 0],
    "head": [-4, 0, -4],
    "spine": [0, 0, 0],
    "chest": [0, 0, 0]
   }
  },
  {
   "t": 0.7,
   "raw": {
    "upperarm_R": [-10, -78, -74.1],
    "forearm_R": [-93.49, 0, 0],
    "finger_index_1_R": [-6, 0, 0],
    "finger_ring_1_R": [6, 0, 0],
    "head": [-4, 0, -4],
    "spine": [0, 0, 0],
    "chest": [0, 0, 0]
   }
  },
  {
   "t": 0.8,
   "raw": {
    "upperarm_R": [-10, -78, -74.1],
    "forearm_R": [-109.69, 0, 0],
    "finger_index_1_R": [-6, 0, 0],
    "finger_ring_1_R": [6, 0, 0],
    "head": [-4, 0, -4],
    "spine": [0, 0, 0],
    "chest": [0, 0, 0]
   }
  },
  {
   "t": 0.9,
   "raw": {
    "upperarm_R": [-10, -78, -74.1],
    "forearm_R": [-115.96, 0, 0],
    "finger_index_1_R": [-6, 0, 0],
    "finger_ring_1_R": [6, 0, 0],
    "head": [-4, 0, -4],
    "spine": [0, 0, 0],
    "chest": [0, 0, 0]
   }
  },
  {
   "t": 1,
   "raw": {
    "upperarm_R": [-10, -78, -74.1],
    "forearm_R": [-107.76, 0, 0],
    "finger_index_1_R": [-6, 0, 0],
    "finger_ring_1_R": [6, 0, 0],
    "head": [-4, 0, -4],
    "spine": [0, 0, 0],
    "chest": [0, 0, 0]
   }
  },
  {
   "t": 1.1,
   "raw": {
    "upperarm_R": [-10, -78, -74.1],
    "forearm_R": [-91.03, 0, 0],
    "finger_index_1_R": [-6, 0, 0],
    "finger_ring_1_R": [6, 0, 0],
    "head": [-4, 0, -4],
    "spine": [0, 0, 0],
    "chest": [0, 0, 0]
   }
  },
  {
   "t": 1.2,
   "raw": {
    "upperarm_R": [-10, -78, -74.1],
    "forearm_R": [-77.9, 0, 0],
    "finger_index_1_R": [-6, 0, 0],
    "finger_ring_1_R": [6, 0, 0],
    "head": [-4, 0, -4],
    "spine": [0, 0, 0],
    "chest": [0, 0, 0]
   }
  },
  {
   "t": 1.3,
   "raw": {
    "upperarm_R": [-10, -78, -74.1],
    "forearm_R": [-77.9, 0, 0],
    "finger_index_1_R": [-6, 0, 0],
    "finger_ring_1_R": [6, 0, 0],
    "head": [-4, 0, -4],
    "spine": [0, 0, 0],
    "chest": [0, 0, 0]
   }
  },
  {
   "t": 1.4,
   "raw": {
    "upperarm_R": [-10, -78, -74.1],
    "forearm_R": [-91.03, 0, 0],
    "finger_index_1_R": [-6, 0, 0],
    "finger_ring_1_R": [6, 0, 0],
    "head": [-4, 0, -4],
    "spine": [0, 0, 0],
    "chest": [0, 0, 0]
   }
  },
  {
   "t": 1.5,
   "raw": {
    "upperarm_R": [-10, -78, -74.1],
    "forearm_R": [-107.76, 0, 0],
    "finger_index_1_R": [-6, 0, 0],
    "finger_ring_1_R": [6, 0, 0],
    "head": [-4, 0, -4],
    "spine": [0, 0, 0],
    "chest": [0, 0, 0]
   }
  },
  {
   "t": 1.6,
   "raw": {
    "upperarm_R": [-10, -78, -74.1],
    "forearm_R": [-115.96, 0, 0],
    "finger_index_1_R": [-6, 0, 0],
    "finger_ring_1_R": [6, 0, 0],
    "head": [-4, 0, -4],
    "spine": [0, 0, 0],
    "chest": [0, 0, 0]
   }
  },
  {
   "t": 1.7,
   "raw": {
    "upperarm_R": [-10, -78, -74.1],
    "forearm_R": [-109.69, 0, 0],
    "finger_index_1_R": [-6, 0, 0],
    "finger_ring_1_R": [6, 0, 0],
    "head": [-4, 0, -4],
    "spine": [0, 0, 0],
    "chest": [0, 0, 0]
   }
  },
  {
   "t": 1.8,
   "raw": {
    "upperarm_R": [-10, -78, -74.1],
    "forearm_R": [-93.49, 0, 0],
    "finger_index_1_R": [-6, 0, 0],
    "finger_ring_1_R": [6, 0, 0],
    "head": [-4, 0, -4],
    "spine": [0, 0, 0],
    "chest": [0, 0, 0]
   }
  },
  {
   "t": 1.9,
   "raw": {
    "upperarm_R": [-10, -78, -74.1],
    "forearm_R": [-79.11, 0, 0],
    "finger_index_1_R": [-6, 0, 0],
    "finger_ring_1_R": [6, 0, 0],
    "head": [-4, 0, -4],
    "spine": [0, 0, 0],
    "chest": [0, 0, 0]
   }
  },
  {
   "t": 2,
   "raw": {
    "upperarm_R": [-10, -78, -74.1],
    "forearm_R": [-76.98, 0, 0],
    "finger_index_1_R": [-6, 0, 0],
    "finger_ring_1_R": [6, 0, 0],
    "head": [-4, 0, -4],
    "spine": [0, 0, 0],
    "chest": [0, 0, 0]
   }
  },
  {
   "t": 2.1,
   "raw": {
    "upperarm_R": [-10, -78, -74.1],
    "forearm_R": [-88.64, 0, 0],
    "finger_index_1_R": [-6, 0, 0],
    "finger_ring_1_R": [6, 0, 0],
    "head": [-4, 0, -4],
    "spine": [0, 0, 0],
    "chest": [0, 0, 0]
   }
  },
  {
   "t": 2.2,
   "raw": {
    "upperarm_R": [-10, -78, -74.1],
    "forearm_R": [-105.64, 0, 0],
    "finger_index_1_R": [-6, 0, 0],
    "finger_ring_1_R": [6, 0, 0],
    "head": [-4, 0, -4],
    "spine": [0, 0, 0],
    "chest": [0, 0, 0]
   }
  },
  {
   "t": 2.3,
   "raw": {
    "upperarm_R": [-10, -78, -74.1],
    "forearm_R": [-115.65, 0, 0],
    "finger_index_1_R": [-6, 0, 0],
    "finger_ring_1_R": [6, 0, 0],
    "head": [-2.96, 0, -4],
    "spine": [1.46, 0, 0],
    "chest": [0.83, 0, 0]
   }
  },
  {
   "t": 2.4,
   "raw": {
    "upperarm_R": [-10, -78, -74.1],
    "forearm_R": [-111.41, 0, 0],
    "finger_index_1_R": [-6, 0, 0],
    "finger_ring_1_R": [6, 0, 0],
    "head": [-0.48, 0, -4],
    "spine": [4.93, 0, 0],
    "chest": [2.82, 0, 0]
   }
  },
  {
   "t": 2.5,
   "raw": {
    "upperarm_R": [-10, -78, -74.1],
    "forearm_R": [-96, 0, 0],
    "finger_index_1_R": [-6, 0, 0],
    "finger_ring_1_R": [6, 0, 0],
    "head": [2.48, 0, -4],
    "spine": [9.07, 0, 0],
    "chest": [5.18, 0, 0]
   }
  },
  {
   "t": 2.6,
   "raw": {
    "upperarm_R": [-10, -78, -74.1],
    "forearm_R": [-80.59, 0, 0],
    "finger_index_1_R": [-6, 0, 0],
    "finger_ring_1_R": [6, 0, 0],
    "head": [4.96, 0, -4],
    "spine": [12.54, 0, 0],
    "chest": [7.17, 0, 0]
   }
  },
  {
   "t": 2.7,
   "raw": {
    "upperarm_R": [-10, -78, -74.1],
    "forearm_R": [-76.35, 0, 0],
    "finger_index_1_R": [-6, 0, 0],
    "finger_ring_1_R": [6, 0, 0],
    "head": [6, 0, -4],
    "spine": [14, 0, 0],
    "chest": [8, 0, 0]
   }
  },
  {
   "t": 2.8,
   "raw": {
    "upperarm_R": [-10, -78, -74.1],
    "forearm_R": [-86.36, 0, 0],
    "finger_index_1_R": [-6, 0, 0],
    "finger_ring_1_R": [6, 0, 0],
    "head": [6, 0, -4],
    "spine": [14, 0, 0],
    "chest": [8, 0, 0]
   }
  },
  {
   "t": 2.9,
   "raw": {
    "upperarm_R": [-10, -78, -74.1],
    "forearm_R": [-103.36, 0, 0],
    "finger_index_1_R": [-6, 0, 0],
    "finger_ring_1_R": [6, 0, 0],
    "head": [6, 0, -4],
    "spine": [14, 0, 0],
    "chest": [8, 0, 0]
   }
  },
  {
   "t": 3,
   "raw": {
    "upperarm_R": [-10, -78, -74.1],
    "forearm_R": [-115.02, 0, 0],
    "finger_index_1_R": [-6, 0, 0],
    "finger_ring_1_R": [6, 0, 0],
    "head": [5.18, 0, -3.78],
    "spine": [12.54, 0, 0],
    "chest": [7.17, 0, 0]
   }
  },
  {
   "t": 3.1,
   "raw": {
    "upperarm_R": [-9.77, -76.18, -72.37],
    "forearm_R": [-109.87, 0, 0],
    "finger_index_1_R": [-5.86, 0, 0],
    "finger_ring_1_R": [5.86, 0, 0],
    "head": [3.27, 0, -3.21],
    "spine": [9.07, 0, 0],
    "chest": [5.18, 0, 0]
   }
  },
  {
   "t": 3.2,
   "raw": {
    "upperarm_R": [-8.17, -63.76, -60.57],
    "forearm_R": [-80.15, 0, 0],
    "finger_index_1_R": [-4.9, 0, 0],
    "finger_ring_1_R": [4.9, 0, 0],
    "head": [1.09, 0, -2.43],
    "spine": [4.93, 0, 0],
    "chest": [2.82, 0, 0]
   }
  },
  {
   "t": 3.3,
   "raw": {
    "upperarm_R": [-5.68, -44.3, -42.09],
    "forearm_R": [-50.11, 0, 0],
    "finger_index_1_R": [-3.41, 0, 0],
    "finger_ring_1_R": [3.41, 0, 0],
    "head": [-0.53, 0, -1.57],
    "spine": [1.46, 0, 0],
    "chest": [0.83, 0, 0]
   }
  },
  {
   "t": 3.4,
   "raw": {
    "upperarm_R": [-3.01, -23.44, -22.27],
    "forearm_R": [-27.05, 0, 0],
    "finger_index_1_R": [-1.8, 0, 0],
    "finger_ring_1_R": [1.8, 0, 0],
    "head": [-0.79, 0, -0.79],
    "spine": [0, 0, 0],
    "chest": [0, 0, 0]
   }
  },
  {
   "t": 3.5,
   "raw": {
    "upperarm_R": [-0.87, -6.8, -6.46],
    "forearm_R": [-8.28, 0, 0],
    "finger_index_1_R": [-0.52, 0, 0],
    "finger_ring_1_R": [0.52, 0, 0],
    "head": [-0.22, 0, -0.22],
    "spine": [0, 0, 0],
    "chest": [0, 0, 0]
   }
  },
  {
   "t": 3.6,
   "raw": {
    "upperarm_R": [0, 0, 0],
    "forearm_R": [0, 0, 0],
    "finger_index_1_R": [0, 0, 0],
    "finger_ring_1_R": [0, 0, 0],
    "head": [0, 0, 0],
    "spine": [0, 0, 0],
    "chest": [0, 0, 0]
   }
  }
 ]
}