{
 "name": "pointing",
 "description": "Right arm extended forward-right, index finger extended.",
 "duration": 2.6,
 "loop": false,
 "priority": 8,
 "keys": [
  {
   "t": 0,
   "raw": {
    "upperarm_R": [0, 0, 0],
    "forearm_R": [0, 0, 0],
    "finger_thumb_1_R": [0, 0, 0],
    "finger_thumb_2_R": [0, 0, 0],
    "finger_middle_1_R": [0, 0, 0],
    "finger_middle_2_R": [0, 0, 0],
    "finger_ring_1_R": [0, 0, 0],
    "finger_ring_2_R": [0, 0, 0],
    "head": [0, 0, 0]
   }
  },
  {
   "t": 0.1,
   "raw": {
    "upperarm_R": [-8.11, 0, -1.25],
    "forearm_R": [-0.62, 0, 0],
    "finger_thumb_1_R": [0, 0, 4.73],
    "finger_thumb_2_R": [0, 0, 5.1],
    "finger_middle_1_R": [0, 0, 8.84],
    "finger_middle_2_R": [0, 0, 9.88],
    "finger_ring_1_R": [0, 0, 8.84],
    "finger_ring_2_R": [0, 0, 9.88],
    "head": [-0.31, -1.46, 0]
   }
  },
  {
   "t": 0.2,
   "raw": {
    "upperarm_R": [-27.46, 0, -4.22],
    "forearm_R": [-2.11, 0, 0],
    "finger_thumb_1_R": [0, 0, 16.02],
    "finger_thumb_2_R": [0, 0, 17.25],
    "finger_middle_1_R": [0, 0, 29.92],
    "finger_middle_2_R": [0, 0, 33.44],
    "finger_ring_1_R": [0, 0, 29.92],
    "finger_ring_2_R": [0, 0, 33.44],
    "head": [-1.06, -4.93, 0]
   }
  },
  {
   "t": 0.3,
   "raw": {
    "upperarm_R": [-50.54, 0, -7.78],
    "forearm_R": [-3.89, 0, 0],
    "finger_thumb_1_R": [0, 0, 29.48],
    "finger_thumb_2_R": [0, 0, 31.75],
    "finger_middle_1_R": [0, 0, 55.08],
    "finger_middle_2_R": [0, 0, 61.56],
    "finger_ring_1_R": [0, 0, 55.08],
    "finger_ring_2_R": [0, 0, 61.56],
    "head": [-1.94, -9.07, 0]
   }
  },
  {
   "t": 0.4,
   "raw": {
    "upperarm_R": [-69.89, 0, -10.75],
    "forearm_R": [-5.38, 0, 0],
    "finger_thumb_1_R": [0, 0, 40.77],
    "finger_thumb_2_R": [0, 0, 43.9],
    "finger_middle_1_R": [0, 0, 76.16],
    "finger_middle_2_R": [0, 0, 85.12],
    "finger_ring_1_R": [0, 0, 76.16],
    "finger_ring_2_R": [0, 0, 85.12],
    "head": [-2.69, -12.54, 0]
   }
  },
  {
   "t": 0.5,
   "raw": {
    "upperarm_R": [-78, 0, -12],
    "forearm_R": [-6, 0, 0],
    "finger_thumb_1_R": [0, 0, 45.5],
    "finger_thumb_2_R": [0, 0, 49],
    "finger_middle_1_R": [0, 0, 85],
    "finger_middle_2_R": [0, 0, 95],
    "finger_ring_1_R": [0, 0, 85],
    "finger_ring_2_R": [0, 0, 95],
    "head": [-3, -14, 0]
   }
  },
  {
   "t": 0.6,
   "raw": {
    "upperarm_R": [-78, 0, -12],
    "forearm_R": [-6, 0, 0],
    "finger_thumb_1_R": [0, 0, 45.5],
    "finger_thumb_2_R": [0, 0, 49],
    "finger_middle_1_R": [0, 0, 85],
    "finger_middle_2_R": [0, 0, 95],
    "finger_ring_1_R": [0, 0, 85],
    "finger_ring_2_R": [0, 0, 95],
    "head": [-3, -14, 0]
   }
  },
  {
   "t": 0.7,
   "raw": {
    "upperarm_R": [-78, 0, -12],
    "forearm_R": [-6, 0, 0],
    "finger_thumb_1_R": [0, 0, 45.5],
    "finger_thumb_2_R": [0, 0, 49],
    "finger_middle_1_R": [0, 0, 85],
    "finger_middle_2_R": [0, 0, 95],
    "finger_ring_1_R": [0, 0, 85],
    "finger_ring_2_R": [0, 0, 95],
    "head": [-3, -14, 0]
   }
  },
  {
   "t": 0.8,
   "raw": {
    "upperarm_R": [-78, 0, -12],
    "forearm_R": [-6, 0, 0],
    "finger_thumb_1_R": [0, 0, 45.5],
    "finger_thumb_2_R": [0, 0, 49],
    "finger_middle_1_R": [0, 0, 85],
    "finger_middle_2_R": [0, 0, 95],
    "finger_ring_1_R": [0, 0, 85],
    "finger_ring_2_R": [0, 0, 95],
    "head": [-3, -14, 0]
   }
  },
  {
   "t": 0.9,
   "raw": {
    "upperarm_R": [-78, 0, -12],
    "forearm_R": [-6, 0, 0],
    "finger_thumb_1_R": [0, 0, 45.5],
    "finger_thumb_2_R": [0, 0, 49],
    "finger_middle_1_R": [0, 0, 85],
    "finger_middle_2_R": [0, 0, 95],
    "finger_ring_1_R": [0, 0, 85],
    "finger_ring_2_R": [0, 0, 95],
    "head": [-3, -14, 0]
   }
  },
  {
   "t": 1,
   "raw": {
    "upperarm_R": [-78, 0, -12],
    "forearm_R": [-6, 0, 0],
    "finger_thumb_1_R": [0, 0, 45.5],
    "finger_thumb_2_R": [0, 0, 49],
    "finger_middle_1_R": [0, 0, 85],
    "finger_middle_2_R": [0, 0, 95],
    "finger_ring_1_R": [0, 0, 85],
    "finger_ring_2_R": [0, 0, 95],
    "head": [-3, -14, 0]
   }
  },
  {
   "t": 1.1,
   "raw": {
    "upperarm_R": [-78, 0, -12],
    "forearm_R": [-6, 0, 0],
    "finger_thumb_1_R": [0, 0, 45.5],
    "finger_thumb_2_R": [0, 0, 49],
    "finger_middle_1_R": [0, 0, 85],
    "finger_middle_2_R": [0, 0, 95],
    "finger_ring_1_R": [0, 0, 85],
    "finger_ring_2_R": [0, 0, 95],
    "head": [-3, -14, 0]
   }
  },
  {
   "t": 1.2,
   "raw": {
    "upperarm_R": [-78, 0, -12],
    "forearm_R": [-6, 0, 0],
    "finger_thumb_1_R": [0, 0, 45.5],
    "finger_thumb_2_R": [0, 0, 49],
    "finger_middle_1_R": [0, 0, 85],
    "finger_middle_2_R": [0, 0, 95],
    "finger_ring_1_R": [0, 0, 85],
    "finger_ring_2_R": [0, 0, 95],
    "head": [-3, -14, 0]
   }
  },
  {
   "t": 1.3,
   "raw": {
    "upperarm_R": [-78, 0, -12],
    "forearm_R": [-6, 0, 0],
    "finger_thumb_1_R": [0, 0, 45.5],
    "finger_thumb_2_R": [0, 0, 49],
    "finger_middle_1_R": [0, 0, 85],
    "finger_middle_2_R": [0, 0, 95],
    "finger_ring_1_R": [0, 0, 85],
    "finger_ring_2_R": [0, 0, 95],
    "head": [-3, -14, 0]
   }
  },
  {
   "t": 1.4,
   "raw": {
    "upperarm_R": [-78, 0, -12],
    "forearm_R": [-6, 0, 0],
    "finger_thumb_1_R": [0, 0, 45.5],
    "finger_thumb_2_R": [0, 0, 49],
    "finger_middle_1_R": [0, 0, 85],
    "finger_middle_2_R": [0, 0, 95],
    "finger_ring_1_R": [0, 0, 85],
    "finger_ring_2_R": [0, 0, 95],
    "head": [-3, -14, 0]
   }
  },
  {
   "t": 1.5,
   "raw": {
    "upperarm_R": [-78, 0, -12],
    "forearm_R": [-6, 0, 0],
    "finger_thumb_1_R": [0, 0, 45.5],
    "finger_thumb_2_R": [0, 0, 49],
    "finger_middle_1_R": [0, 0, 85],
    "finger_middle_2_R": [0, 0, 95],
    "finger_ring_1_R": [0, 0, 85],
    "finger_ring_2_R": [0, 0, 95],
    "head": [-3, -14, 0]
   }
  },
  {
   "t": 1.6,
   "raw": {
    "upperarm_R": [-78, 0, -12],
    "forearm_R": [-6, 0, 0],
    "finger_thumb_1_R": [0, 0, 45.5],
    "finger_thumb_2_R": [0, 0, 49],
    "finger_middle_1_R": [0, 0, 85],
    "finger_middle_2_R": [0, 0, 95],
    "finger_ring_1_R": [0, 0, 85],
    "finger_ring_2_R": [0, 0, 95],
    "head": [-3, -14, 0]
   }
  },
  {
   "t": 1.7,
   "raw": {
    "upperarm_R": [-78, 0, -12],
    "forearm_R": [-6, 0, 0],
    "finger_thumb_1_R": [0, 0, 45.5],
    "finger_thumb_2_R": [0, 0, 49],
    "finger_middle_1_R": [0, 0, 85],
    "finger_middle_2_R": [0, 0, 95],
    "finger_ring_1_R": [0, 0, 85],
    "finger_ring_2_R": [0, 0, 95],
    "head": [-3, -14, 0]
   }
  },
  {
   "t": 1.8,
   "raw": {
    "upperarm_R": [-78, 0, -12],
    "forearm_R": [-6, 0, 0],
    "finger_thumb_1_R": [0, 0, 45.5],
    "finger_thumb_2_R": [0, 0, 49],
    "finger_middle_1_R": [0, 0, 85],
    "finger_middle_2_R": [0, 0, 95],
    "finger_ring_1_R": [0, 0, 85],
    "finger_ring_2_R": [0, 0, 95],
    "head": [-3, -14, 0]
   }
  },
  {
   "t": 1.9,
   "raw": {
    "upperarm_R": [-78, 0, -12],
    "forearm_R": [-6, 0, 0],
    "finger_thumb_1_R": [0, 0, 45.5],
    "finger_thumb_2_R": [0, 0, 49],
    "finger_middle_1_R": [0, 0, 85],
    "finger_middle_2_R": [0, 0, 95],
    "finger_ring_1_R": [0, 0, 85],
    "finger_ring_2_R": [0, 0, 95],
    "head": [-3, -14, 0]
   }
  },
  {
   "t": 2,
   "raw": {
    "upperarm_R": [-78, 0, -12],
    "forearm_R": [-6, 0, 0],
    "finger_thumb_1_R": [0, 0, 45.5],
    "finger_thumb_2_R": [0, 0, 49],
    "finger_middle_1_R": [0, 0, 85],
    "finger_middle_2_R": [0, 0, 95],
    "finger_ring_1_R": [0, 0, 85],
    "finger_ring_2_R": [0, 0, 95],
    "head": [-3, -14, 0]
   }
  },
  {
   "t": 2.1,
   "raw": {
    "upperarm_R": [-72.22, 0, -11.11],
    "forearm_R": [-5.56, 0, 0],
    "finger_thumb_1_R": [0, 0, 42.13],
    "finger_thumb_2_R": [0, 0, 45.37],
    "finger_middle_1_R": [0, 0, 78.7],
    "finger_middle_2_R": [0, 0, 87.96],
    "finger_ring_1_R": [0, 0, 78.7],
    "finger_ring_2_R": [0, 0, 87.96],
    "head": [-2.78, -12.96, 0]
   }
  },
  {
   "t": 2.2,
   "raw": {
    "upperarm_R": [-57.78, 0, -8.89],
    "forearm_R": [-4.44, 0, 0],
    "finger_thumb_1_R": [0, 0, 33.7],
    "finger_thumb_2_R": [0, 0, 36.3],
    "finger_middle_1_R": [0, 0, 62.96],
    "finger_middle_2_R": [0, 0, 70.37],
    "finger_ring_1_R": [0, 0, 62.96],
    "finger_ring_2_R": [0, 0, 70.37],
    "head": [-2.22, -10.37, 0]
   }
  },
  {
   "t": 2.3,
   "raw": {
    "upperarm_R": [-39, 0, -6],
    "forearm_R": [-3, 0, 0],
    "finger_thumb_1_R": [0, 0, 22.75],
    "finger_thumb_2_R": [0, 0, 24.5],
    "finger_middle_1_R": [0, 0, 42.5],
    "finger_middle_2_R": [0, 0, 47.5],
    "finger_ring_1_R": [0, 0, 42.5],
    "finger_ring_2_R": [0, 0, 47.5],
    "head": [-1.5, -7, 0]
   }
  },
  {
   "t": 2.4,
   "raw": {
    "upperarm_R": [-20.22, 0, -3.11],
    "forearm_R": [-1.56, 0, 0],
    "finger_thumb_1_R": [0, 0, 11.8],
    "finger_thumb_2_R": [0, 0, 12.7],
    "finger_middle_1_R": [0, 0, 22.04],
    "finger_middle_2_R": [0, 0, 24.63],
    "finger_ring_1_R": [0, 0, 22.04],
    "finger_ring_2_R": [0, 0, 24.63],
    "head": [-0.78, -3.63, 0]
   }
  },
  {
   "t": 2.5,
   "raw": {
    "upperarm_R": [-5.78, 0, -0.89],
    "forearm_R": [-0.44, 0, 0],
    "finger_thumb_1_R": [0, 0, 3.37],
    "finger_thumb_2_R": [0, 0, 3.63],
    "finger_middle_1_R": [0, 0, 6.3],
    "finger_middle_2_R": [0, 0, 7.04],
    "finger_ring_1_R": [0, 0, 6.3],
    "finger_ring_2_R": [0, 0, 7.04],
    "head": [-0.22, -1.04, 0]
   }
  },
  {
   "t": 2.6,
   "raw": {
    "upperarm_R": [0, 0, 0],
    "forearm_R": [0, 0, 0],
    "finger_thumb_1_R": [0, 0, 0],
    "finger_thumb_2_R": [0, 0, 0],
    "finger_middle_1_R": [0, 0, 0],
    "finger_middle_2_R": [0, 0, 0],
    "finger_ring_1_R": [0, 0, 0],
    "finger_ring_2_R": [0, 0, 0],
    "head": [0, 0, 0]
   }
  }
 ]
}