{
 "name": "greeting",
 "description": "Friendly raised-hand wave with a welcoming head tilt.",
 "duration": 3,
 "loop": false,
 "priority": 6,
 "keys": [
  {
   "t": 0,
   "raw": {
    "upperarm_R": [0, 0, 0],
    "forearm_R": [0, 0, 0],
    "finger_index_1_R": [0, 0, 0],
    "finger_ring_1_R": [0, 0, 0],
    "spine": [0, 0, 0],
    "head": [0, 0, 0]
   },
   "pelvis": {"x": 0, "y": 0, "z": 0}
  },
  {
   "t": 0.1,
   "raw": {
    "upperarm_R": [-0.38, -2.98, -2.98],
    "forearm_R": [-3.71, 0, 0],
    "finger_index_1_R": [-0.23, 0, 0],
    "finger_ring_1_R": [0.23, 0, 0],
    "spine": [0.08, 0, 0],
    "head": [-0.19, 0, -0.23]
   },
   "pelvis": {"x": 0, "y": -0.0003, "z": 0}
  },
  {
   "t": 0.2,
   "raw": {
    "upperarm_R": [-1.4, -10.92, -10.92],
    "forearm_R": [-13.77, 0, 0],
    "finger_index_1_R": [-0.84, 0, 0],
    "finger_ring_1_R": [0.84, 0, 0],
    "spine": [0.28, 0, 0],
    "head": [-0.7, 0, -0.84]
   },
   "pelvis": {"x": 0, "y": -0.0011, "z": 0}
  },
  {
   "t": 0.3,
   "raw": {
    "upperarm_R": [-2.86, -22.29, -22.29],
    "forearm_R": [-26.6, 0, 0],
    "finger_index_1_R": [-1.71, 0, 0],
    "finger_ring_1_R": [1.71, 0, 0],
    "spine": [0.57, 0, 0],
    "head": [-1.43, 0, -1.71]
   },
   "pelvis": {"x": 0, "y": -0.0023, "z": 0}
  },
  {
   "t": 0.4,
   "raw": {
    "upperarm_R": [-4.56, -35.56, -35.56],
    "forearm_R": [-38.79, 0, 0],
    "finger_index_1_R": [-2.74, 0, 0],
    "finger_ring_1_R": [2.74, 0, 0],
    "spine": [0.91, 0, 0],
    "head": [-2.28, 0, -2.74]
   },
   "pelvis": {"x": 0, "y": -0.0036, "z": 0}
  },
  {
   "t": 0.5,
   "raw": {
    "upperarm_R": [-6.31, -49.22, -49.22],
    "forearm_R": [-57.62, 0, 0],
    "finger_index_1_R": [-3.79, 0, 0],
    "finger_ring_1_R": [3.79, 0, 0],
    "spine": [1.26, 0, 0],
    "head": [-3.15, 0, -3.79]
   },
   "pelvis": {"x": 0, "y": -0.005, "z": 0}
  },
  {
   "t": 0.6,
   "raw": {
    "upperarm_R": [-7.91, -61.73, -61.73],
    "forearm_R": [-87.55, 0, 0],
    "finger_index_1_R": [-4.75, 0, 0],
    "finger_ring_1_R": [4.75, 0, 0],
    "spine": [1.58, 0, 0],
    "head": [-3.96, 0, -4.75]
   },
   "pelvis": {"x": 0, "y": -0.0063, "z": 0}
  },
  {
   "t": 0.7,
   "raw": {
    "upperarm_R": [-9.18, -71.57, -71.57],
    "forearm_R": [-105.79, 0, 0],
    "finger_index_1_R": [-5.51, 0, 0],
    "finger_ring_1_R": [5.51, 0, 0],
    "spine": [1.84, 0, 0],
    "head": [-4.59, 0, -5.51]
   },
   "pelvis": {"x": 0, "y": -0.0073, "z": 0}
  },
  {
   "t": 0.8,
   "raw": {
    "upperarm_R": [-9.9, -77.22, -77.22],
    "forearm_R": [-92.09, 0, 0],
    "finger_index_1_R": [-5.94, 0, 0],
    "finger_ring_1_R": [5.94, 0, 0],
    "spine": [1.98, 0, 0],
    "head": [-4.95, 0, -5.94]
   },
   "pelvis": {"x": 0, "y": -0.0079, "z": 0}
  },
  {
   "t": 0.9,
   "raw": {
    "upperarm_R": [-10, -78, -78],
    "forearm_R": [-72.75, 0, 0],
    "finger_index_1_R": [-6, 0, 0],
    "finger_ring_1_R": [6, 0, 0],
    "spine": [2, 0, 0],
    "head": [-5, 0, -6]
   },
   "pelvis": {"x": 0, "y": -0.008, "z": 0}
  },
  {
   "t": 1,
   "raw": {
    "upperarm_R": [-10, -78, -78],
    "forearm_R": [-81.89, 0, 0],
    "finger_index_1_R": [-6, 0, 0],
    "finger_ring_1_R": [6, 0, 0],
    "spine": [2, 0, 0],
    "head": [-5, 0, -6]
   },
   "pelvis": {"x": 0, "y": -0.008, "z": 0}
  },
  {
   "t": 1.1,
   "raw": {
    "upperarm_R": [-10, -78, -78],
    "forearm_R": [-108.86, 0, 0],
    "finger_index_1_R": [-6, 0, 0],
    "finger_ring_1_R": [6, 0, 0],
    "spine": [2, 0, 0],
    "head": [-5, 0, -6]
   },
   "pelvis": {"x": 0, "y": -0.008, "z": 0}
  },
  {
   "t": 1.2,
   "raw": {
    "upperarm_R": [-10, -78, -78],
    "forearm_R": [-119.57, 0, 0],
    "finger_index_1_R": [-6, 0, 0],
    "finger_ring_1_R": [6, 0, 0],
    "spine": [2, 0, 0],
    "head": [-5, 0, -6]
   },
   "pelvis": {"x": 0, "y": -0.008, "z": 0}
  },
  {
   "t": 1.3,
   "raw": {
    "upperarm_R": [-10, -78, -78],
    "forearm_R": [-100.5, 0, 0],
    "finger_index_1_R": [-6, 0, 0],
    "finger_ring_1_R": [6, 0, 0],
    "spine": [2, 0, 0],
    "head": [-5, 0, -6]
   },
   "pelvis": {"x": 0, "y": -0.008, "z": 0}
  },
  {
   "t": 1.4,
   "raw": {
    "upperarm_R": [-10, -78, -78],
    "forearm_R": [-75.74, 0, 0],
    "finger_index_1_R": [-6, 0, 0],
    "finger_ring_1_R": [6, 0, 0],
    "spine": [2, 0, 0],
    "head": [-5, 0, -6]
   },
   "pelvis": {"x": 0, "y": -0.008, "z": 0}
  },
  {
   "t": 1.5,
   "raw": {
    "upperarm_R": [-10, -78, -78],
    "forearm_R": [-76.58, 0, 0],
    "finger_index_1_R": [-6, 0, 0],
    "finger_ring_1_R": [6, 0, 0],
    "spine": [2, 0, 0],
    "head": [-5, 0, -6]
   },
   "pelvis": {"x": 0, "y": -0.008, "z": 0}
  },
  {
   "t": 1.6,
   "raw": {
    "upperarm_R": [-10, -78, -78],
    "forearm_R": [-101.97, 0, 0],
    "finger_index_1_R": [-6, 0, 0],
    "finger_ring_1_R": [6, 0, 0],
    "spine": [2, 0, 0],
    "head": [-5, 0, -6]
   },
   "pelvis": {"x": 0, "y": -0.008, "z": 0}
  },
  {
   "t": 1.7,
   "raw": {
    "upperarm_R": [-10, -78, -78],
    "forearm_R": [-119.81, 0, 0],
    "finger_index_1_R": [-6, 0, 0],
    "finger_ring_1_R": [6, 0, 0],
    "spine": [2, 0, 0],
    "head": [-5, 0, -6]
   },
   "pelvis": {"x": 0, "y": -0.008, "z": 0}
  },
  {
   "t": 1.8,
   "raw": {
    "upperarm_R": [-10, -78, -78],
    "forearm_R": [-107.56, 0, 0],
    "finger_index_1_R": [-6, 0, 0],
    "finger_ring_1_R": [6, 0, 0],
    "spine": [2, 0, 0],
    "head": [-5, 0, -6]
   },
   "pelvis": {"x": 0, "y": -0.008, "z": 0}
  },
  {
   "t": 1.9,
   "raw": {
    "upperarm_R": [-10, -78, -78],
    "forearm_R": [-80.7, 0, 0],
    "finger_index_1_R": [-6, 0, 0],
    "finger_ring_1_R": [6, 0, 0],
    "spine": [2, 0, 0],
    "head": [-5, 0, -6]
   },
   "pelvis": {"x": 0, "y": -0.008, "z": 0}
  },
  {
   "t": 2,
   "raw": {
    "upperarm_R": [-10, -78, -78],
    "forearm_R": [-73.17, 0, 0],
    "finger_index_1_R": [-6, 0, 0],
    "finger_ring_1_R": [6, 0, 0],
    "spine": [2, 0, 0],
    "head": [-5, 0, -6]
   },
   "pelvis": {"x": 0, "y": -0.008, "z": 0}
  },
  {
   "t": 2.1,
   "raw": {
    "upperarm_R": [-10, -78, -78],
    "forearm_R": [-94.49, 0, 0],
    "finger_index_1_R": [-6, 0, 0],
    "finger_ring_1_R": [6, 0, 0],
    "spine": [2, 0, 0],
    "head": [-5, 0, -6]
   },
   "pelvis": {"x": 0, "y": -0.008, "z": 0}
  },
  {
   "t": 2.2,
   "raw": {
    "upperarm_R": [-9.9, -77.22, -77.22],
    "forearm_R": [-116.33, 0, 0],
    "finger_index_1_R": [-5.94, 0, 0],
    "finger_ring_1_R": [5.94, 0, 0],
    "spine": [1.98, 0, 0],
    "head": [-4.95, 0, -5.94]
   },
   "pelvis": {"x": 0, "y": -0.0079, "z": 0}
  },
  {
   "t": 2.3,
   "raw": {
    "upperarm_R": [-9.18, -71.57, -71.57],
    "forearm_R": [-102.82, 0, 0],
    "finger_index_1_R": [-5.51, 0, 0],
    "finger_ring_1_R": [5.51, 0, 0],
    "spine": [1.84, 0, 0],
    "head": [-4.59, 0, -5.51]
   },
   "pelvis": {"x": 0, "y": -0.0073, "z": 0}
  },
  {
   "t": 2.4,
   "raw": {
    "upperarm_R": [-7.91, -61.73, -61.73],
    "forearm_R": [-70.44, 0, 0],
    "finger_index_1_R": [-4.75, 0, 0],
    "finger_ring_1_R": [4.75, 0, 0],
    "spine": [1.58, 0, 0],
    "head": [-3.96, 0, -4.75]
   },
   "pelvis": {"x": 0, "y": -0.0063, "z": 0}
  },
  {
   "t": 2.5,
   "raw": {
    "upperarm_R": [-6.31, -49.22, -49.22],
    "forearm_R": [-51.02, 0, 0],
    "finger_index_1_R": [-3.79, 0, 0],
    "finger_ring_1_R": [3.79, 0, 0],
    "spine": [1.26, 0, 0],
    "head": [-3.15, 0, -3.79]
   },
   "pelvis": {"x": 0, "y": -0.005, "z": 0}
  },
  {
   "t": 2.6,
   "raw": {
    "upperarm_R": [-4.56, -35.56, -35.56],
    "forearm_R": [-41.93, 0, 0],
    "finger_index_1_R": [-2.74, 0, 0],
    "finger_ring_1_R": [2.74, 0, 0],
    "spine": [0.91, 0, 0],
    "head": [-2.28, 0, -2.74]
   },
   "pelvis": {"x": 0, "y": -0.0036, "z": 0}
  },
  {
   "t": 2.7,
   "raw": {
    "upperarm_R": [-2.86, -22.29, -22.29],
    "forearm_R": [-28.86, 0, 0],
    "finger_index_1_R": [-1.71, 0, 0],
    "finger_ring_1_R": [1.71, 0, 0],
    "spine": [0.57, 0, 0],
    "head": [-1.43, 0, -1.71]
   },
   "pelvis": {"x": 0, "y": -0.0023, "z": 0}
  },
  {
   "t": 2.8,
   "raw": {
    "upperarm_R": [-1.4, -10.92, -10.92],
    "forearm_R": [-13.87, 0, 0],
    "finger_index_1_R": [-0.84, 0, 0],
    "finger_ring_1_R": [0.84, 0, 0],
    "spine": [0.28, 0, 0],
    "head": [-0.7, 0, -0.84]
   },
   "pelvis": {"x": 0, "y": -0.0011, "z": 0}
  },
  {
   "t": 2.9,
   "raw": {
    "upperarm_R": [-0.38, -2.98, -2.98],
    "forearm_R": [-3.67, 0, 0],
    "finger_index_1_R": [-0.23, 0, 0],
    "finger_ring_1_R": [0.23, 0, 0],
    "spine": [0.08, 0, 0],
    "head": [-0.19, 0, -0.23]
   },
   "pelvis": {"x": 0, "y": -0.0003, "z": 0}
  },
  {
   "t": 3,
   "raw": {
    "upperarm_R": [0, 0, 0],
    "forearm_R": [0, 0, 0],
    "finger_index_1_R": [0, 0, 0],
    "finger_ring_1_R": [0, 0, 0],
    "spine": [0, 0, 0],
    "head": [0, 0, 0]
   },
   "pelvis": {"x": 0, "y": 0, "z": 0}
  }
 ]
}