{
 "name": "bow",
 "description": "Polite bow.",
 "duration": 2.4,
 "loop": false,
 "priority": 6,
 "keys": [
  {
   "t": 0,
   "raw": {
    "spine": [0, 0, 0],
    "chest": [0, 0, 0],
    "head": [0, 0, 0]
   },
   "pelvis": {"x": 0, "y": 0, "z": 0}
  },
  {
   "t": 0.1,
   "raw": {
    "spine": [0.77, 0, 0],
    "chest": [0.43, 0, 0],
    "head": [0.34, 0, 0]
   },
   "pelvis": {"x": 0, "y": 0, "z": -0.0013}
  },
  {
   "t": 0.2,
   "raw": {
    "spine": [2.81, 0, 0],
    "chest": [1.56, 0, 0],
    "head": [1.25, 0, 0]
   },
   "pelvis": {"x": 0, "y": 0, "z": -0.0047}
  },
  {
   "t": 0.3,
   "raw": {
    "spine": [5.7, 0, 0],
    "chest": [3.16, 0, 0],
    "head": [2.53, 0, 0]
   },
   "pelvis": {"x": 0, "y": 0, "z": -0.0095}
  },
  {
   "t": 0.4,
   "raw": {
    "spine": [9, 0, 0],
    "chest": [5, 0, 0],
    "head": [4, 0, 0]
   },
   "pelvis": {"x": 0, "y": 0, "z": -0.015}
  },
  {
   "t": 0.5,
   "raw": {
    "spine": [12.3, 0, 0],
    "chest": [6.84, 0, 0],
    "head": [5.47, 0, 0]
   },
   "pelvis": {"x": 0, "y": 0, "z": -0.0205}
  },
  {
   "t": 0.6,
   "raw": {
    "spine": [15.19, 0, 0],
    "chest": [8.44, 0, 0],
    "head": [6.75, 0, 0]
   },
   "pelvis": {"x": 0, "y": 0, "z": -0.0253}
  },
  {
   "t": 0.7,
   "raw": {
    "spine": [17.23, 0, 0],
    "chest": [9.57, 0, 0],
    "head": [7.66, 0, 0]
   },
   "pelvis": {"x": 0, "y": 0, "z": -0.0287}
  },
  {
   "t": 0.8,
   "raw": {
    "spine": [18, 0, 0],
    "chest": [10, 0, 0],
    "head": [8, 0, 0]
   },
   "pelvis": {"x": 0, "y": 0, "z": -0.03}
  },
  {
   "t": 0.9,
   "raw": {
    "spine": [18, 0, 0],
    "chest": [10, 0, 0],
    "head": [8, 0, 0]
   },
   "pelvis": {"x": 0, "y": 0, "z": -0.03}
  },
  {
   "t": 1,
   "raw": {
    "spine": [18, 0, 0],
    "chest": [10, 0, 0],
    "head": [8, 0, 0]
   },
   "pelvis": {"x": 0, "y": 0, "z": -0.03}
  },
  {
   "t": 1.1,
   "raw": {
    "spine": [18, 0, 0],
    "chest": [10, 0, 0],
    "head": [8, 0, 0]
   },
   "pelvis": {"x": 0, "y": 0, "z": -0.03}
  },
  {
   "t": 1.2,
   "raw": {
    "spine": [18, 0, 0],
    "chest": [10, 0, 0],
    "head": [8, 0, 0]
   },
   "pelvis": {"x": 0, "y": 0, "z": -0.03}
  },
  {
   "t": 1.3,
   "raw": {
    "spine": [18, 0, 0],
    "chest": [10, 0, 0],
    "head": [8, 0, 0]
   },
   "pelvis": {"x": 0, "y": 0, "z": -0.03}
  },
  {
   "t": 1.4,
   "raw": {
    "spine": [18, 0, 0],
    "chest": [10, 0, 0],
    "head": [8, 0, 0]
   },
   "pelvis": {"x": 0, "y": 0, "z": -0.03}
  },
  {
   "t": 1.5,
   "raw": {
    "spine": [18, 0, 0],
    "chest": [10, 0, 0],
    "head": [8, 0, 0]
   },
   "pelvis": {"x": 0, "y": 0, "z": -0.03}
  },
  {
   "t": 1.6,
   "raw": {
    "spine": [18, 0, 0],
    "chest": [10, 0, 0],
    "head": [8, 0, 0]
   },
   "pelvis": {"x": 0, "y": 0, "z": -0.03}
  },
  {
   "t": 1.7,
   "raw": {
    "spine": [17.23, 0, 0],
    "chest": [9.57, 0, 0],
    "head": [7.66, 0, 0]
   },
   "pelvis": {"x": 0, "y": 0, "z": -0.0287}
  },
  {
   "t": 1.8,
   "raw": {
    "spine": [15.19, 0, 0],
    "chest": [8.44, 0, 0],
    "head": [6.75, 0, 0]
   },
   "pelvis": {"x": 0, "y": 0, "z": -0.0253}
  },
  {
   "t": 1.9,
   "raw": {
    "spine": [12.3, 0, 0],
    "chest": [6.84, 0, 0],
    "head": [5.47, 0, 0]
   },
   "pelvis": {"x": 0, "y": 0, "z": -0.0205}
  },
  {
   "t": 2,
   "raw": {
    "spine": [9, 0, 0],
    "chest": [5, 0, 0],
    "head": [4, 0, 0]
   },
   "pelvis": {"x": 0, "y": 0, "z": -0.015}
  },
  {
   "t": 2.1,
   "raw": {
    "spine": [5.7, 0, 0],
    "chest": [3.16, 0, 0],
    "head": [2.53, 0, 0]
   },
   "pelvis": {"x": 0, "y": 0, "z": -0.0095}
  },
  {
   "t": 2.2,
   "raw": {
    "spine": [2.81, 0, 0],
    "chest": [1.56, 0, 0],
    "head": [1.25, 0, 0]
   },
   "pelvis": {"x": 0, "y": 0, "z": -0.0047}
  },
  {
   "t": 2.3,
   "raw": {
    "spine": [0.77, 0, 0],
    "chest": [0.43, 0, 0],
    "head": [0.34, 0, 0]
   },
   "pelvis": {"x": 0, "y": 0, "z": -0.0013}
  },
  {
   "t": 2.4,
   "raw": {
    "spine": [0, 0, 0],
    "chest": [0, 0, 0],
    "head": [0, 0, 0]
   },
   "pelvis": {"x": 0, "y": 0, "z": 0}
  }
 ]
}