{
 "name": "nod",
 "description": "Two small head nods (acknowledge).",
 "duration": 1.2,
 "loop": false,
 "priority": 5,
 "keys": [
  {
   "t": 0,
   "raw": {
    "head": [0, 0, 0]
   }
  },
  {
   "t": 0.1,
   "raw": {
    "head": [12.27, 0, 0]
   }
  },
  {
   "t": 0.2,
   "raw": {
    "head": [11.82, 0, 0]
   }
  },
  {
   "t": 0.3,
   "raw": {
    "head": [-0.88, 0, 0]
   }
  },
  {
   "t": 0.4,
   "raw": {
    "head": [-12.67, 0, 0]
   }
  },
  {
   "t": 0.5,
   "raw": {
    "head": [-11.33, 0, 0]
   }
  },
  {
   "t": 0.6,
   "raw": {
    "head": [1.75, 0, 0]
   }
  },
  {
   "t": 0.7,
   "raw": {
    "head": [13.02, 0, 0]
   }
  },
  {
   "t": 0.8,
   "raw": {
    "head": [10.79, 0, 0]
   }
  },
  {
   "t": 0.9,
   "raw": {
    "head": [-2.62, 0, 0]
   }
  },
  {
   "t": 1,
   "raw": {
    "head": [-9.86, 0, 0]
   }
  },
  {
   "t": 1.1,
   "raw": {
    "head": [-2.65, 0, 0]
   }
  },
  {
   "t": 1.2,
   "raw": {
    "head": [0, 0, 0]
   }
  }
 ]
}