{
 "name": "surprised",
 "description": "Quick recoil with raised open hands.",
 "duration": 1.8,
 "loop": false,
 "priority": 6,
 "keys": [
  {
   "t": 0,
   "raw": {
    "upperarm_L": [0, 0, 0],
    "forearm_L": [0, 0, 0],
    "upperarm_R": [0, 0, 0],
    "forearm_R": [0, 0, 0],
    "spine": [0, 0, 0],
    "head": [0, 0, 0],
    "clavicle_L": [0, 0, 0],
    "clavicle_R": [0, 0, 0]
   },
   "pelvis": {"x": 0, "y": 0, "z": 0}
  },
  {
   "t": 0.1,
   "raw": {
    "upperarm_L": [-9.62, 0, 27.26],
    "forearm_L": [-38.48, 0, 0],
    "upperarm_R": [-9.62, 0, -27.26],
    "forearm_R": [-38.48, 0, 0],
    "spine": [-4.81, 0, 0],
    "head": [-7.22, 0, 0],
    "clavicle_L": [0, 0, 6.41],
    "clavicle_R": [0, 0, -6.41]
   },
   "pelvis": {"x": 0, "y": 0, "z": -0.0096}
  },
  {
   "t": 0.2,
   "raw": {
    "upperarm_L": [-12, 0, 34],
    "forearm_L": [-47.27, 0, 0],
    "upperarm_R": [-12, 0, -34],
    "forearm_R": [-47.27, 0, 0],
    "spine": [-5.91, 0, 0],
    "head": [-8.86, 0, 0],
    "clavicle_L": [0, 0, 8],
    "clavicle_R": [0, 0, -8]
   },
   "pelvis": {"x": 0, "y": 0, "z": -0.012}
  },
  {
   "t": 0.3,
   "raw": {
    "upperarm_L": [-12, 0, 34],
    "forearm_L": [-43.78, 0, 0],
    "upperarm_R": [-12, 0, -34],
    "forearm_R": [-43.78, 0, 0],
    "spine": [-5.47, 0, 0],
    "head": [-8.21, 0, 0],
    "clavicle_L": [0, 0, 8],
    "clavicle_R": [0, 0, -8]
   },
   "pelvis": {"x": 0, "y": 0, "z": -0.012}
  },
  {
   "t": 0.4,
   "raw": {
    "upperarm_L": [-12, 0, 34],
    "forearm_L": [-39.38, 0, 0],
    "upperarm_R": [-12, 0, -34],
    "forearm_R": [-39.38, 0, 0],
    "spine": [-4.92, 0, 0],
    "head": [-7.38, 0, 0],
    "clavicle_L": [0, 0, 8],
    "clavicle_R": [0, 0, -8]
   },
   "pelvis": {"x": 0, "y": 0, "z": -0.012}
  },
  {
   "t": 0.5,
   "raw": {
    "upperarm_L": [-12, 0, 34],
    "forearm_L": [-36.34, 0, 0],
    "upperarm_R": [-12, 0, -34],
    "forearm_R": [-36.34, 0, 0],
    "spine": [-4.54, 0, 0],
    "head": [-6.81, 0, 0],
    "clavicle_L": [0, 0, 8],
    "clavicle_R": [0, 0, -8]
   },
   "pelvis": {"x": 0, "y": 0, "z": -0.012}
  },
  {
   "t": 0.6,
   "raw": {
    "upperarm_L": [-12, 0, 34],
    "forearm_L": [-36, 0, 0],
    "upperarm_R": [-12, 0, -34],
    "forearm_R": [-36, 0, 0],
    "spine": [-4.5, 0, 0],
    "head": [-6.75, 0, 0],
    "clavicle_L": [0, 0, 8],
    "clavicle_R": [0, 0, -8]
   },
   "pelvis": {"x": 0, "y": 0, "z": -0.012}
  },
  {
   "t": 0.7,
   "raw": {
    "upperarm_L": [-12, 0, 34],
    "forearm_L": [-36, 0, 0],
    "upperarm_R": [-12, 0, -34],
    "forearm_R": [-36, 0, 0],
    "spine": [-4.5, 0, 0],
    "head": [-6.75, 0, 0],
    "clavicle_L": [0, 0, 8],
    "clavicle_R": [0, 0, -8]
   },
   "pelvis": {"x": 0, "y": 0, "z": -0.012}
  },
  {
   "t": 0.8,
   "raw": {
    "upperarm_L": [-12, 0, 34],
    "forearm_L": [-36, 0, 0],
    "upperarm_R": [-12, 0, -34],
    "forearm_R": [-36, 0, 0],
    "spine": [-4.5, 0, 0],
    "head": [-6.75, 0, 0],
    "clavicle_L": [0, 0, 8],
    "clavicle_R": [0, 0, -8]
   },
   "pelvis": {"x": 0, "y": 0, "z": -0.012}
  },
  {
   "t": 0.9,
   "raw": {
    "upperarm_L": [-12, 0, 34],
    "forearm_L": [-36, 0, 0],
    "upperarm_R": [-12, 0, -34],
    "forearm_R": [-36, 0, 0],
    "spine": [-4.5, 0, 0],
    "head": [-6.75, 0, 0],
    "clavicle_L": [0, 0, 8],
    "clavicle_R": [0, 0, -8]
   },
   "pelvis": {"x": 0, "y": 0, "z": -0.012}
  },
  {
   "t": 1,
   "raw": {
    "upperarm_L": [-12, 0, 34],
    "forearm_L": [-36, 0, 0],
    "upperarm_R": [-12, 0, -34],
    "forearm_R": [-36, 0, 0],
    "spine": [-4.5, 0, 0],
    "head": [-6.75, 0, 0],
    "clavicle_L": [0, 0, 8],
    "clavicle_R": [0, 0, -8]
   },
   "pelvis": {"x": 0, "y": 0, "z": -0.012}
  },
  {
   "t": 1.1,
   "raw": {
    "upperarm_L": [-12, 0, 34],
    "forearm_L": [-36, 0, 0],
    "upperarm_R": [-12, 0, -34],
    "forearm_R": [-36, 0, 0],
    "spine": [-4.5, 0, 0],
    "head": [-6.75, 0, 0],
    "clavicle_L": [0, 0, 8],
    "clavicle_R": [0, 0, -8]
   },
   "pelvis": {"x": 0, "y": 0, "z": -0.012}
  },
  {
   "t": 1.2,
   "raw": {
    "upperarm_L": [-12, 0, 34],
    "forearm_L": [-36, 0, 0],
    "upperarm_R": [-12, 0, -34],
    "forearm_R": [-36, 0, 0],
    "spine": [-4.5, 0, 0],
    "head": [-6.75, 0, 0],
    "clavicle_L": [0, 0, 8],
    "clavicle_R": [0, 0, -8]
   },
   "pelvis": {"x": 0, "y": 0, "z": -0.012}
  },
  {
   "t": 1.3,
   "raw": {
    "upperarm_L": [-11.11, 0, 31.48],
    "forearm_L": [-33.33, 0, 0],
    "upperarm_R": [-11.11, 0, -31.48],
    "forearm_R": [-33.33, 0, 0],
    "spine": [-4.17, 0, 0],
    "head": [-6.25, 0, 0],
    "clavicle_L": [0, 0, 7.41],
    "clavicle_R": [0, 0, -7.41]
   },
   "pelvis": {"x": 0, "y": 0, "z": -0.0111}
  },
  {
   "t": 1.4,
   "raw": {
    "upperarm_L": [-8.89, 0, 25.19],
    "forearm_L": [-26.67, 0, 0],
    "upperarm_R": [-8.89, 0, -25.19],
    "forearm_R": [-26.67, 0, 0],
    "spine": [-3.33, 0, 0],
    "head": [-5, 0, 0],
    "clavicle_L": [0, 0, 5.93],
    "clavicle_R": [0, 0, -5.93]
   },
   "pelvis": {"x": 0, "y": 0, "z": -0.0089}
  },
  {
   "t": 1.5,
   "raw": {
    "upperarm_L": [-6, 0, 17],
    "forearm_L": [-18, 0, 0],
    "upperarm_R": [-6, 0, -17],
    "forearm_R": [-18, 0, 0],
    "spine": [-2.25, 0, 0],
    "head": [-3.38, 0, 0],
    "clavicle_L": [0, 0, 4],
    "clavicle_R": [0, 0, -4]
   },
   "pelvis": {"x": 0, "y": 0, "z": -0.006}
  },
  {
   "t": 1.6,
   "raw": {
    "upperarm_L": [-3.11, 0, 8.81],
    "forearm_L": [-9.33, 0, 0],
    "upperarm_R": [-3.11, 0, -8.81],
    "forearm_R": [-9.33, 0, 0],
    "spine": [-1.17, 0, 0],
    "head": [-1.75, 0, 0],
    "clavicle_L": [0, 0, 2.07],
    "clavicle_R": [0, 0, -2.07]
   },
   "pelvis": {"x": 0, "y": 0, "z": -0.0031}
  },
  {
   "t": 1.7,
   "raw": {
    "upperarm_L": [-0.89, 0, 2.52],
    "forearm_L": [-2.67, 0, 0],
    "upperarm_R": [-0.89, 0, -2.52],
    "forearm_R": [-2.67, 0, 0],
    "spine": [-0.33, 0, 0],
    "head": [-0.5, 0, 0],
    "clavicle_L": [0, 0, 0.59],
    "clavicle_R": [0, 0, -0.59]
   },
   "pelvis": {"x": 0, "y": 0, "z": -0.0009}
  },
  {
   "t": 1.8,
   "raw": {
    "upperarm_L": [0, 0, 0],
    "forearm_L": [0, 0, 0],
    "upperarm_R": [0, 0, 0],
    "forearm_R": [0, 0, 0],
    "spine": [0, 0, 0],
    "head": [0, 0, 0],
    "clavicle_L": [0, 0, 0],
    "clavicle_R": [0, 0, 0]
   },
   "pelvis": {"x": 0, "y": 0, "z": 0}
  }
 ]
}