{
 "name": "shake",
 "description": "Head shake (disagree).",
 "duration": 1.2,
 "loop": false,
 "priority": 5,
 "keys": [
  {
   "t": 0,
   "raw": {
    "head": [0, 0, 0]
   }
  },
  {
   "t": 0.1,
   "raw": {
    "head": [0, 19.02, 0]
   }
  },
  {
   "t": 0.2,
   "raw": {
    "head": [0, 11.76, 0]
   }
  },
  {
   "t": 0.3,
   "raw": {
    "head": [0, -11.76, 0]
   }
  },
  {
   "t": 0.4,
   "raw": {
    "head": [0, -19.02, 0]
   }
  },
  {
   "t": 0.5,
   "raw": {
    "head": [0, 0, 0]
   }
  },
  {
   "t": 0.6,
   "raw": {
    "head": [0, 19.02, 0]
   }
  },
  {
   "t": 0.7,
   "raw": {
    "head": [0, 11.76, 0]
   }
  },
  {
   "t": 0.8,
   "raw": {
    "head": [0, -11.76, 0]
   }
  },
  {
   "t": 0.9,
   "raw": {
    "head": [0, -19.02, 0]
   }
  },
  {
   "t": 1,
   "raw": {
    "head": [0, 0, 0]
   }
  },
  {
   "t": 1.1,
   "raw": {
    "head": [0, 4.93, 0]
   }
  },
  {
   "t": 1.2,
   "raw": {
    "head": [0, 0, 0]
   }
  }
 ]
}