{
 "name": "happy",
 "description": "Cheerful bounce with arms raised.",
 "duration": 2.2,
 "loop": false,
 "priority": 6,
 "keys": [
  {
   "t": 0,
   "raw": {
    "upperarm_L": [0, 0, 0],
    "forearm_L": [0, 0, 0],
    "upperarm_R": [0, 0, 0],
    "forearm_R": [0, 0, 0],
    "head": [0, 0, 0],
    "spine": [0, 0, 0]
   },
   "pelvis": {"x": 0, "y": 0, "z": 0}
  },
  {
   "t": 0.1,
   "raw": {
    "upperarm_L": [-23.44, 0, 4.69],
    "forearm_L": [-2.82, 0, 0],
    "upperarm_R": [-23.44, 0, -4.69],
    "forearm_R": [-2.82, 0, 0],
    "head": [-1.41, 0, -0.59],
    "spine": [-0.47, 0, 0]
   },
   "pelvis": {"x": 0, "y": -0.0042, "z": 0}
  },
  {
   "t": 0.2,
   "raw": {
    "upperarm_L": [-75, 0, 15],
    "forearm_L": [-11.82, 0, 0],
    "upperarm_R": [-75, 0, -15],
    "forearm_R": [-11.82, 0, 0],
    "head": [-4.5, 0, -3.18],
    "spine": [-1.5, 0, 0]
   },
   "pelvis": {"x": 0, "y": -0.0008, "z": 0}
  },
  {
   "t": 0.3,
   "raw": {
    "upperarm_L": [-126.56, 0, 25.31],
    "forearm_L": [-18.29, 0, 0],
    "upperarm_R": [-126.56, 0, -25.31],
    "forearm_R": [-18.29, 0, 0],
    "head": [-7.59, 0, -5.85],
    "spine": [-2.53, 0, 0]
   },
   "pelvis": {"x": 0, "y": -0.0088, "z": 0}
  },
  {
   "t": 0.4,
   "raw": {
    "upperarm_L": [-150, 0, 30],
    "forearm_L": [-15.36, 0, 0],
    "upperarm_R": [-150, 0, -30],
    "forearm_R": [-15.36, 0, 0],
    "head": [-9, 0, -5.29],
    "spine": [-3, 0, 0]
   },
   "pelvis": {"x": 0, "y": -0.0389, "z": 0}
  },
  {
   "t": 0.5,
   "raw": {
    "upperarm_L": [-150, 0, 30],
    "forearm_L": [-14.95, 0, 0],
    "upperarm_R": [-150, 0, -30],
    "forearm_R": [-14.95, 0, 0],
    "head": [-9, 0, -1.97],
    "spine": [-3, 0, 0]
   },
   "pelvis": {"x": 0, "y": -0.0407, "z": 0}
  },
  {
   "t": 0.6,
   "raw": {
    "upperarm_L": [-150, 0, 30],
    "forearm_L": [-21.13, 0, 0],
    "upperarm_R": [-150, 0, -30],
    "forearm_R": [-21.13, 0, 0],
    "head": [-9, 0, 1.97],
    "spine": [-3, 0, 0]
   },
   "pelvis": {"x": 0, "y": -0.0129, "z": 0}
  },
  {
   "t": 0.7,
   "raw": {
    "upperarm_L": [-150, 0, 30],
    "forearm_L": [-23.84, 0, 0],
    "upperarm_R": [-150, 0, -30],
    "forearm_R": [-23.84, 0, 0],
    "head": [-9, 0, 5.29],
    "spine": [-3, 0, 0]
   },
   "pelvis": {"x": 0, "y": -0.0007, "z": 0}
  },
  {
   "t": 0.8,
   "raw": {
    "upperarm_L": [-150, 0, 30],
    "forearm_L": [-18.69, 0, 0],
    "upperarm_R": [-150, 0, -30],
    "forearm_R": [-18.69, 0, 0],
    "head": [-9, 0, 6.93],
    "spine": [-3, 0, 0]
   },
   "pelvis": {"x": 0, "y": -0.0239, "z": 0}
  },
  {
   "t": 0.9,
   "raw": {
    "upperarm_L": [-150, 0, 30],
    "forearm_L": [-14.04, 0, 0],
    "upperarm_R": [-150, 0, -30],
    "forearm_R": [-14.04, 0, 0],
    "head": [-9, 0, 6.37],
    "spine": [-3, 0, 0]
   },
   "pelvis": {"x": 0, "y": -0.0448, "z": 0}
  },
  {
   "t": 1,
   "raw": {
    "upperarm_L": [-150, 0, 30],
    "forearm_L": [-17.45, 0, 0],
    "upperarm_R": [-150, 0, -30],
    "forearm_R": [-17.45, 0, 0],
    "head": [-9, 0, 3.78],
    "spine": [-3, 0, 0]
   },
   "pelvis": {"x": 0, "y": -0.0295, "z": 0}
  },
  {
   "t": 1.1,
   "raw": {
    "upperarm_L": [-150, 0, 30],
    "forearm_L": [-23.38, 0, 0],
    "upperarm_R": [-150, 0, -30],
    "forearm_R": [-23.38, 0, 0],
    "head": [-9, 0, 0],
    "spine": [-3, 0, 0]
   },
   "pelvis": {"x": 0, "y": -0.0028, "z": 0}
  },
  {
   "t": 1.2,
   "raw": {
    "upperarm_L": [-150, 0, 30],
    "forearm_L": [-22.19, 0, 0],
    "upperarm_R": [-150, 0, -30],
    "forearm_R": [-22.19, 0, 0],
    "head": [-9, 0, -3.78],
    "spine": [-3, 0, 0]
   },
   "pelvis": {"x": 0, "y": -0.0082, "z": 0}
  },
  {
   "t": 1.3,
   "raw": {
    "upperarm_L": [-150, 0, 30],
    "forearm_L": [-15.81, 0, 0],
    "upperarm_R": [-150, 0, -30],
    "forearm_R": [-15.81, 0, 0],
    "head": [-9, 0, -6.37],
    "spine": [-3, 0, 0]
   },
   "pelvis": {"x": 0, "y": -0.0368, "z": 0}
  },
  {
   "t": 1.4,
   "raw": {
    "upperarm_L": [-150, 0, 30],
    "forearm_L": [-14.62, 0, 0],
    "upperarm_R": [-150, 0, -30],
    "forearm_R": [-14.62, 0, 0],
    "head": [-9, 0, -6.93],
    "spine": [-3, 0, 0]
   },
   "pelvis": {"x": 0, "y": -0.0422, "z": 0}
  },
  {
   "t": 1.5,
   "raw": {
    "upperarm_L": [-150, 0, 30],
    "forearm_L": [-20.55, 0, 0],
    "upperarm_R": [-150, 0, -30],
    "forearm_R": [-20.55, 0, 0],
    "head": [-9, 0, -5.29],
    "spine": [-3, 0, 0]
   },
   "pelvis": {"x": 0, "y": -0.0155, "z": 0}
  },
  {
   "t": 1.6,
   "raw": {
    "upperarm_L": [-150, 0, 30],
    "forearm_L": [-23.96, 0, 0],
    "upperarm_R": [-150, 0, -30],
    "forearm_R": [-23.96, 0, 0],
    "head": [-9, 0, -1.97],
    "spine": [-3, 0, 0]
   },
   "pelvis": {"x": 0, "y": -0.0002, "z": 0}
  },
  {
   "t": 1.7,
   "raw": {
    "upperarm_L": [-150, 0, 30],
    "forearm_L": [-19.31, 0, 0],
    "upperarm_R": [-150, 0, -30],
    "forearm_R": [-19.31, 0, 0],
    "head": [-9, 0, 1.97],
    "spine": [-3, 0, 0]
   },
   "pelvis": {"x": 0, "y": -0.0211, "z": 0}
  },
  {
   "t": 1.8,
   "raw": {
    "upperarm_L": [-134.4, 0, 26.88],
    "forearm_L": [-12.68, 0, 0],
    "upperarm_R": [-134.4, 0, -26.88],
    "forearm_R": [-12.68, 0, 0],
    "head": [-8.06, 0, 4.74],
    "spine": [-2.69, 0, 0]
   },
   "pelvis": {"x": 0, "y": -0.0397, "z": 0}
  },
  {
   "t": 1.9,
   "raw": {
    "upperarm_L": [-97.2, 0, 19.44],
    "forearm_L": [-10.93, 0, 0],
    "upperarm_R": [-97.2, 0, -19.44],
    "forearm_R": [-10.93, 0, 0],
    "head": [-5.83, 0, 4.49],
    "spine": [-1.94, 0, 0]
   },
   "pelvis": {"x": 0, "y": -0.0208, "z": 0}
  },
  {
   "t": 2,
   "raw": {
    "upperarm_L": [-52.8, 0, 10.56],
    "forearm_L": [-8.11, 0, 0],
    "upperarm_R": [-52.8, 0, -10.56],
    "forearm_R": [-8.11, 0, 0],
    "head": [-3.17, 0, 2.24],
    "spine": [-1.06, 0, 0]
   },
   "pelvis": {"x": 0, "y": -0.0015, "z": 0}
  },
  {
   "t": 2.1,
   "raw": {
    "upperarm_L": [-15.6, 0, 3.12],
    "forearm_L": [-2.36, 0, 0],
    "upperarm_R": [-15.6, 0, -3.12],
    "forearm_R": [-2.36, 0, 0],
    "head": [-0.94, 0, 0.39],
    "spine": [-0.31, 0, 0]
   },
   "pelvis": {"x": 0, "y": -0.0006, "z": 0}
  },
  {
   "t": 2.2,
   "raw": {
    "upperarm_L": [0, 0, 0],
    "forearm_L": [0, 0, 0],
    "upperarm_R": [0, 0, 0],
    "forearm_R": [0, 0, 0],
    "head": [0, 0, 0],
    "spine": [0, 0, 0]
   },
   "pelvis": {"x": 0, "y": 0, "z": 0}
  }
 ]
}